{
  "event_id": "a9b8c7d6-e5f4-3a2b-1c0d-fe9876543210",
  "ts": "2026-10-22T09:14:15.000Z",
  "source": "desktop",
  "kind": "window_switch",
  "app": {
    "id": "acme-portal",
    "type": "web",
    "domain": "portal.acme.local",
    "process": "chrome.exe",
    "window_title": "Acme Internal Portal - Overdue Invoices"
  },
  "target": {
    "role": "window",
    "name": "Chrome - Acme Portal",
    "testid": null,
    "label": null,
    "css": null,
    "xpath": null,
    "uia": {
      "automation_id": "Chrome_WidgetWin_1",
      "control_type": "UIA_WindowControlTypeId",
      "name": "Acme Internal Portal"
    },
    "bbox": [0, 0, 1920, 1080]
  },
  "value": {
    "redacted": true,
    "shape": "none",
    "text": null
  },
  "page": {
    "url_pattern": "/reports/overdue",
    "url_params": {}
  },
  "session_id": "99998888-7777-6666-5555-444433332222"
}
